{
  "diagnostic_id": "evercompass",
  "name": "EverCompass Diagnostic",
  "version": "1.0.0",
  "status": "draft",
  "journey_stages": [
    "attract",
    "engage",
    "convert",
    "retain"
  ],
  "dimensions": [
    "marketing_strategy",
    "ux_design",
    "brand_identity",
    "systems_integration"
  ],
  "maturity_scale": [
    {
      "score": 1,
      "classification": "needs_attention",
      "meaning": "Absent / severely limited"
    },
    {
      "score": 2,
      "classification": "needs_attention",
      "meaning": "Informal / inconsistent"
    },
    {
      "score": 3,
      "classification": "developing",
      "meaning": "Functional / defined"
    },
    {
      "score": 4,
      "classification": "strong",
      "meaning": "Intentional / structured"
    },
    {
      "score": 5,
      "classification": "operationalized",
      "meaning": "Integrated / continuously improved"
    }
  ],
  "severity_levels": {
    "low": {
      "meaning": "Improvement opportunity with limited immediate/systemic consequence"
    },
    "moderate": {
      "meaning": "Meaningful weakness that may constrain performance"
    },
    "high": {
      "meaning": "Significant weakness that may materially affect the journey or connected areas"
    },
    "critical": {
      "meaning": "Fundamental condition that may substantially prevent the relevant journey stage from functioning"
    }
  },
  "criteria": [
    {
      "id": "attract.marketing_strategy.audience",
      "journey_stage": "attract",
      "dimension": "marketing_strategy",
      "question": "How clearly defined is the audience your business is trying to attract?",
      "response": {
        "type": "maturity_1_5",
        "evidence": true,
        "applicability": true
      },
      "evaluation": {
        "rule": {
          "type": "threshold",
          "bands_ref": "maturity_scale"
        }
      },
      "finding": {
        "finding_ref": "audience"
      },
      "severity": {
        "rule": null
      }
    },
    {
      "id": "attract.marketing_strategy.positioning",
      "journey_stage": "attract",
      "dimension": "marketing_strategy",
      "question": "How clearly does the business communicate why a customer should choose it over alternatives?",
      "response": {
        "type": "maturity_1_5",
        "evidence": true,
        "applicability": true
      },
      "evaluation": {
        "rule": {
          "type": "threshold",
          "bands_ref": "maturity_scale"
        }
      },
      "finding": {
        "finding_ref": "positioning"
      },
      "severity": {
        "rule": null
      }
    },
    {
      "id": "attract.marketing_strategy.channels",
      "journey_stage": "attract",
      "dimension": "marketing_strategy",
      "question": "How intentionally does the business select and use channels to reach its target audience?",
      "response": {
        "type": "maturity_1_5",
        "evidence": true,
        "applicability": true
      },
      "evaluation": {
        "rule": {
          "type": "threshold",
          "bands_ref": "maturity_scale"
        }
      },
      "finding": {
        "finding_ref": "channels"
      },
      "severity": {
        "rule": null
      }
    },
    {
      "id": "attract.marketing_strategy.acquisition",
      "journey_stage": "attract",
      "dimension": "marketing_strategy",
      "question": "How clearly has the business defined how it will turn its target audience into potential customers?",
      "response": {
        "type": "maturity_1_5",
        "evidence": true,
        "applicability": true
      },
      "evaluation": {
        "rule": {
          "type": "threshold",
          "bands_ref": "maturity_scale"
        }
      },
      "finding": {
        "finding_ref": "acquisition"
      },
      "severity": {
        "rule": null
      }
    },
    {
      "id": "attract.ux_design.discovery_experience",
      "journey_stage": "attract",
      "dimension": "ux_design",
      "question": "How effectively does the business's digital experience help a new visitor understand what the business offers and where to go next?",
      "response": {
        "type": "maturity_1_5",
        "evidence": true,
        "applicability": true
      },
      "evaluation": {
        "rule": {
          "type": "threshold",
          "bands_ref": "maturity_scale"
        }
      },
      "finding": {
        "finding_ref": "discovery_experience"
      },
      "severity": {
        "rule": null
      }
    },
    {
      "id": "attract.ux_design.landing_pages",
      "journey_stage": "attract",
      "dimension": "ux_design",
      "question": "How effectively do the business's landing pages connect a visitor's initial interest to a clear and relevant next step?",
      "response": {
        "type": "maturity_1_5",
        "evidence": true,
        "applicability": true
      },
      "evaluation": {
        "rule": {
          "type": "threshold",
          "bands_ref": "maturity_scale"
        }
      },
      "finding": {
        "finding_ref": "landing_pages"
      },
      "severity": {
        "rule": null
      }
    },
    {
      "id": "attract.ux_design.entry_points",
      "journey_stage": "attract",
      "dimension": "ux_design",
      "question": "How effectively are the business's entry points designed to move visitors from initial discovery into the customer journey?",
      "response": {
        "type": "maturity_1_5",
        "evidence": true,
        "applicability": true
      },
      "evaluation": {
        "rule": {
          "type": "threshold",
          "bands_ref": "maturity_scale"
        }
      },
      "finding": {
        "finding_ref": "entry_points"
      },
      "severity": {
        "rule": null
      }
    },
    {
      "id": "attract.brand_identity.awareness",
      "journey_stage": "attract",
      "dimension": "brand_identity",
      "question": "How effectively does the business establish awareness of its brand among the audience it wants to reach?",
      "response": {
        "type": "maturity_1_5",
        "evidence": true,
        "applicability": true
      },
      "evaluation": {
        "rule": {
          "type": "threshold",
          "bands_ref": "maturity_scale"
        }
      },
      "finding": {
        "finding_ref": "awareness"
      },
      "severity": {
        "rule": null
      }
    },
    {
      "id": "attract.brand_identity.differentiation",
      "journey_stage": "attract",
      "dimension": "brand_identity",
      "question": "How clearly does the business communicate what makes it meaningfully different from alternatives?",
      "response": {
        "type": "maturity_1_5",
        "evidence": true,
        "applicability": true
      },
      "evaluation": {
        "rule": {
          "type": "threshold",
          "bands_ref": "maturity_scale"
        }
      },
      "finding": {
        "finding_ref": "differentiation"
      },
      "severity": {
        "rule": null
      }
    },
    {
      "id": "attract.brand_identity.messaging",
      "journey_stage": "attract",
      "dimension": "brand_identity",
      "question": "How clearly does the business communicate its value and relevance to the audience it wants to attract?",
      "response": {
        "type": "maturity_1_5",
        "evidence": true,
        "applicability": true
      },
      "evaluation": {
        "rule": {
          "type": "threshold",
          "bands_ref": "maturity_scale"
        }
      },
      "finding": {
        "finding_ref": "messaging"
      },
      "severity": {
        "rule": null
      }
    },
    {
      "id": "attract.systems_integration.tracking",
      "journey_stage": "attract",
      "dimension": "systems_integration",
      "question": "How effectively does the business capture the information needed to understand where its customer acquisition activity is coming from and how it is performing?",
      "response": {
        "type": "maturity_1_5",
        "evidence": true,
        "applicability": true
      },
      "evaluation": {
        "rule": {
          "type": "threshold",
          "bands_ref": "maturity_scale"
        }
      },
      "finding": {
        "finding_ref": "tracking"
      },
      "severity": {
        "rule": null
      }
    },
    {
      "id": "attract.systems_integration.attribution",
      "journey_stage": "attract",
      "dimension": "systems_integration",
      "question": "How effectively can the business determine which acquisition sources and activities are contributing to customer opportunities?",
      "response": {
        "type": "maturity_1_5",
        "evidence": true,
        "applicability": true
      },
      "evaluation": {
        "rule": {
          "type": "threshold",
          "bands_ref": "maturity_scale"
        }
      },
      "finding": {
        "finding_ref": "attribution"
      },
      "severity": {
        "rule": null
      }
    },
    {
      "id": "attract.systems_integration.acquisition_infrastructure",
      "journey_stage": "attract",
      "dimension": "systems_integration",
      "question": "How effectively does the business's underlying infrastructure support the acquisition of new customers and opportunities?",
      "response": {
        "type": "maturity_1_5",
        "evidence": true,
        "applicability": true
      },
      "evaluation": {
        "rule": {
          "type": "threshold",
          "bands_ref": "maturity_scale"
        }
      },
      "finding": {
        "finding_ref": "acquisition_infrastructure"
      },
      "severity": {
        "rule": null
      }
    },
    {
      "id": "engage.marketing_strategy.offer",
      "journey_stage": "engage",
      "dimension": "marketing_strategy",
      "question": "How clearly does the business's offer address a meaningful need or opportunity for its intended audience?",
      "response": {
        "type": "maturity_1_5",
        "evidence": true,